word,phonetics,origin,definition,partOfSpeech
un-understandable,ˌən-ˌən-dər-ˈstan-də-bəl,,impossible to understand : not understandable,adjective
electrocorticogram,i-ˌlek-trō-ˈkȯr-ti-kə-ˌgram,,an electroencephalogram made with the electrodes in direct contact with the brain,noun
transcriptionists,tran(t)-ˈskrip-shə-nist,,one that transcribes; especially : a typist who transcribes dictated medical reports,noun
homotransplantations,ˌhō-mō-ˈtran(t)s-ˌplant,,homograft,noun
hypercorrections,ˌhī-pər-kə-ˈrekt,,"of, relating to, or characterized by the production of a nonstandard linguistic form or construction on the basis of a false analogy (such as ""badly"" in ""my eyes have gone badly"")",adjective
hyperconsciousness,ˌhī-pər-ˈkän(t)-shəs,,intensely or excessively aware : acutely conscious,adjective
multi-institutional,ˌməl-tē-ˌin(t)-stə-ˈt(y)ü-sh(ə-)nəl,,"involving, relating to, or occurring within more than one institution",adjective
self-purification,ˌself-ˌpyu̇r-ə-fə-ˈkā-shən,,purification by natural process; purification of oneself,noun
otorhinolaryngologist,ˌō-tō-ˌrī-nō-ˌler-ən-ˈgä-lə-jist,,a physician specializing in otorhinolaryngology : otolaryngologist,noun
indistinguishably,ˌin-di-ˈstiŋ-gwi-shə-bəl,,not distinguishable: such as; lacking identifying or individualizing qualities; not clearly recognizable or understandable,adjective
anti-vaccination,ˌan-tē-ˌvak-sə-ˈnā-shən,,opposed to vaccination,adjective
anti-evolutionists,ˌan-tē-ˌe-və-ˈlü-sh(ə-)nist,,a person who rejects the biological theory of evolution,noun
counteradaptation,ˌkau̇n-tər-ˌa-ˌdap-ˈtā-shən,,"adaptation of an organism (as in modification of behavior, physiology, or form) in response to an adaptation of another organism with which it regularly interacts; also : a favorable trait that arises as a result of counteradaptation; opposition to the effect of a drug or stimulus that is hypothesized to develop in an organism as a mechanism to maintain homeostasis",noun
counter-instance,ˌkau̇n-tər-ˈin(t)-stən(t)s,,"a case that contradicts a rule, theory, etc. : exception",noun
crashworthinesses,ˈkrash-ˌwər-t͟hē,,resistant to the effects of collision,adjective
militaristically,ˈmi-lə-tə-ˌri-zəm,,predominance of the military class or its ideals; exaltation of military virtues and ideals; a policy of aggressive military preparedness,noun
forethoughtfully,ˈfȯr-ˌthȯt-fəl,,full of or having forethought,adjective
internationalize,ˌin-tər-ˈna-sh(ə-)nə-ˌlīz,,to make international; also : to place under international control,verb
newsworthinesses,ˈnüz-ˌwər-t͟hē,,interesting enough to the general public to warrant reporting,adjective
campylobacteriosis,ˌkam-pi-lō-bak-ˌtir-ē-ˈō-səs,,bacterial infection with or disease caused by campylobacter,noun
anti-vivisectionists,ˌan-tē-ˌvi-və-ˈsek-shən,,opposed to experimentation on living animals especially when considered to cause pain or distress to the subject : opposed to vivisection,adjective
orthographically,ˌȯr-thə-ˈgra-fik,,"of, relating to, being, or prepared by orthographic projection; of or relating to orthography; correct in spelling",adjective
internationalizes,ˌin-tər-ˈna-sh(ə-)nə-ˌlīz,,to make international; also : to place under international control,verb
counterretaliation,ˌkau̇n-tər-ri-ˌta-lē-ˈā-shən,,an act of retaliating against a previous retaliatory act,noun
phosphorylations,ˌfäs-ˌfȯr-ə-ˈlā-shən,,the process of phosphorylating a chemical compound either by reaction with inorganic phosphate or by transfer of phosphate from another organic phosphate; especially : the enzymatic conversion of carbohydrates into their phosphoric esters in metabolic processes,noun
sentimentalization,ˌsen-tə-ˈmen-tə-ˌlīz,,to indulge in sentiment; to look upon or imbue with sentiment,verb
encephalopathies,in-ˌse-fə-ˈlä-pə-thē,,a disease of the brain; especially : one involving alterations of brain structure,noun
counterarguments,ˌkau̇n-tər-ˈär-gyə-mənt,,an opposing argument,noun
organophosphorus,ˌȯr-gə-nō-ˈfäs-f(ə-)rəs,,"of, relating to, or being a phosphorus-containing organic compound and especially a pesticide (such as malathion) that acts by inhibiting cholinesterase",adjective
electrooculographies,i-ˌlek-trō-ˌä-kyə-ˈlä-grə-fē,,the preparation and study of electrooculograms,noun
representationally,ˌre-pri-ˌzen-ˈtā-shən,,one that represents: such as; an artistic likeness or image; a statement or account made to influence opinion or action,noun
counter-convention,ˌkau̇n-tər-kən-ˈven(t)-shən,,an assembly of persons gathered in response to or in protest against another assembly : a competing or opposing convention,noun
neurophysiological,ˌnu̇r-ō-ˌfi-zē-ˈä-lə-jē,,physiology of the nervous system,noun
overexcitability,ˌō-vər-ik-ˈsīt,,to excite to an excessive degree,verb
anti-conventional,ˌan-tē-kən-ˈven(t)-sh(ə-)nəl,,opposed to conventional methods and attitudes : emphatically and deliberately unconventional,adjective
biotechnologically,ˌbī-ō-tek-ˈnä-lə-jē,,"the manipulation (as through genetic engineering) of living organisms or their components to produce useful usually commercial products (such as pest resistant crops, new bacterial strains, or novel pharmaceuticals); also : any of various applications of biological science used in such manipulation; ergonomics",noun
dichlorodifluoromethane,(ˌ)dī-ˌklȯr-ə-ˌdī-ˌflu̇r-ə-ˈme-ˌthān,,a chlorofluoromethane CCl2F2,noun
nonmaterialistic,ˌnän-mə-ˌtir-ē-ə-ˈli-stik,,"not of, relating to, or marked by materialism : not materialistic",adjective
overenergetically,ˌō-vər-ˌe-nər-ˈje-tik,,excessively energetic,adjective
platitudinarians,ˌpla-tə-ˌtü-də-ˈner-ē-ən,,one given to the use of platitudes,noun
misrepresentation,(ˌ)mis-ˌre-pri-ˈzent,,to give a false or misleading representation of usually with an intent to deceive or be unfair; to serve badly or improperly as a representative of,verb
institutionalist,ˌin(t)-stə-ˈt(y)ü-sh(ə-)nə-ˌli-zəm,,"emphasis on organization (as in religion) at the expense of other factors; public institutional care of disabled, delinquent, or dependent persons; an economic school of thought that emphasizes the role of social institutions in influencing economic behavior",noun
interavailability,ˌin-tər-ə-ˈvā-lə-bəl,,"of, relating to, or being one of two or more forms of public transportation that service the same route and that accept tickets issued by one another for that route",adjective
hyperresponsiveness,ˌhī-pər-ri-ˈspän(t)-siv,,characterized by an abnormal degree of responsiveness (as to a physical or emotional stimulus),adjective
nontransferability,ˌnän-tran(t)s-ˈfər-ə-bəl,,not capable of being transferred : not transferable,adjective
multilateralists,ˌməl-tē-ˈla-t(ə-)rəl,,having many sides; involving or participated in by more than two nations or parties,adjective
inextinguishable,ˌi-nik-ˈstiŋ-gwi-shə-bəl,,not extinguishable : unquenchable,adjective
pre-incorporation,ˌprē-in-ˌkȯr-pə-ˈrā-shən,,existing or occurring before the formation of a corporation,adjective
megagametophytes,ˌme-gə-gə-ˈmē-tə-ˌfīt,,the female gametophyte produced by a megaspore,noun
overamplification,ˌō-vər-ˈam-plə-ˌfīd,,"excessively amplified: such as; excessively large, great, or strong; electronically amplified to the point of being too loud",adjective
interdepartmentally,ˌin-tər-di-ˌpärt-ˈmen-tᵊl,,"existing, exchanged, or carried on between two or more departments (as of an organization) or their members; especially : characterized by participation or cooperation of two or more departments of an educational institution",adjective
superconductivity,ˌsü-pər-ˌkän-ˌdək-ˈti-və-tē,,a complete disappearance of electrical resistance in a substance especially at very low temperatures,noun
chlortetracyclines,ˌklȯr-ˌte-trə-ˈsī-ˌklēn,,a yellow crystalline broad-spectrum antibiotic C22H23ClN2O8 that is produced by a soil actinomycete (Streptomyces aureofaciens) and is sometimes used in animal feeds to stimulate growth,noun
photographically,ˌfō-tə-ˈgra-fik,,"relating to, obtained by, or used in photography; representing nature and human beings with the exactness of a photograph; capable of retaining vivid impressions",adjective
microelectronics,ˌmī-krō-i-ˌlek-ˈträ-niks,,"a branch of electronics that deals with the miniaturization of electronic circuits and components; devices, equipment, or circuits produced using the methods of microelectronics",noun
noncommutativity,ˌnän-kə-ˈmyü-tə-tiv,,"of, relating to, having, or being the property that a given mathematical operation and set have when the result obtained using any two elements of the set with the operation differs with the order in which the elements are used : not commutative",adjective
electrophotography,i-ˌlek-trō-fə-ˈtä-grə-fē,,photography in which images are produced by electrical means (as in xerography),noun
nonanthropologists,ˌnän-ˌan(t)-thrə-ˈpä-lə-jist,,a person who is not an anthropologist,noun
neuropsychological,ˌnu̇r-ō-sī-ˈkä-lə-jē,,a science concerned with the integration of psychological observations on behavior and the mind with neurological observations on the brain and nervous system,noun
supercivilizations,ˌsü-pər-ˌsi-və-lə-ˈzā-shən,,a highly developed civilization : a society that has advanced to a very high level of cultural or technological development,noun
hydrometeorology,ˌhī-drō-ˌmē-tē-ə-ˈrä-lə-jē,,a branch of meteorology that deals with water in the atmosphere especially as precipitation,noun
intraventricularly,ˌin-trə-ven-ˈtri-kyə-lər,,"situated within, occurring within, or administered into a ventricle",adjective
overindustrialization,ˌō-vər-in-ˈdə-strē-ə-ˌlīz,,to industrialize (something) to an excessive degree,verb
representational,ˌre-pri-ˌzen-ˈtā-shən,,one that represents: such as; an artistic likeness or image; a statement or account made to influence opinion or action,noun
questionableness,ˈkwes-chə-nə-bəl,,"inviting inquiry; liable to judicial inquiry or action; affording reason for being doubted, questioned, or challenged : not certain or exact : problematic",adjective
eschatologically,(ˌ)e-ˌska-tə-ˈlä-ji-kəl,,of or relating to eschatology or an eschatology; of or relating to the end of the world or the events associated with it in eschatology,adjective
overprotectiveness,ˌō-vər-prə-ˈtekt,,to protect (someone or something) more than is necessary or reasonable,verb
counterrevolutionaries,ˌkau̇n-tər-ˌre-və-ˈlü-shən,,a revolution directed toward overthrowing a government or social system established by a previous revolution; a movement to counteract revolutionary trends,noun
transillumination,ˌtran(t)s-ə-ˈlü-mə-ˌnāt,,to cause light to pass through; especially : to pass light through (a body part) for medical examination,verb
nonlinguistically,ˌnän-liŋ-ˈgwi-stik,,not consisting of or related to language : not linguistic,adjective
counterinflation,ˌkau̇n-tər-in-ˈflā-shən,,"acting or intended to stop, slow, reverse, or prevent economic inflation : counterinflationary",adjective
counterrevolution,ˌkau̇n-tər-ˌre-və-ˈlü-shən,,a revolution directed toward overthrowing a government or social system established by a previous revolution; a movement to counteract revolutionary trends,noun
unpretentiousness,ˌən-pri-ˈten(t)-shəs,,"free from ostentation, elegance, or affectation : modest",adjective
interrelationships,ˌin-tər-ri-ˈlāt,,to bring into mutual relation; to have mutual relationship,verb
uncompetitiveness,ˌən-kəm-ˈpe-tə-tiv,,not competitive : unable to compete,adjective
photomicrographs,ˌfō-tə-ˈmī-krə-ˌgraf,,a photograph of a microscope image,noun
superconductivities,ˌsü-pər-ˌkän-ˌdək-ˈti-və-tē,,a complete disappearance of electrical resistance in a substance especially at very low temperatures,noun
internationalities,ˌin-tər-ˈna-sh(ə-)nəl,,"of, relating to, or affecting two or more nations; of, relating to, or constituting a group or association having members in two or more nations; active, known, or reaching beyond national boundaries",adjective
progressivenesses,prə-ˈgre-siv,,"of, relating to, or characterized by progress; making use of or interested in new ideas, findings, or opportunities; of, relating to, or constituting an educational theory marked by emphasis on the individual child, informality of classroom procedure, and encouragement of self-expression",adjective
inhospitableness,ˌin-(ˌ)hä-ˈspi-tə-bəl,,not showing hospitality : not friendly or receptive; providing no shelter or sustenance,adjective
transcendentally,ˌtran(t)-ˌsen-ˈden-tᵊl,,"transcendent; supernatural; abstruse, abstract",adjective
microelectronically,ˌmī-krō-i-ˌlek-ˈträ-niks,,"a branch of electronics that deals with the miniaturization of electronic circuits and components; devices, equipment, or circuits produced using the methods of microelectronics",noun
self-glorification,ˌself-ˌglȯr-ə-fə-ˈkā-shən,,"[""a feeling or expression of one's own superiority""]",noun
overindustrialize,ˌō-vər-in-ˈdə-strē-ə-ˌlīz,,to industrialize (something) to an excessive degree,verb
counter-adaptation,ˌkau̇n-tər-ˌa-ˌdap-ˈtā-shən,,"adaptation of an organism (as in modification of behavior, physiology, or form) in response to an adaptation of another organism with which it regularly interacts; also : a favorable trait that arises as a result of counteradaptation; opposition to the effect of a drug or stimulus that is hypothesized to develop in an organism as a mechanism to maintain homeostasis",noun
exceptionability,ik-ˈsep-sh(ə-)nə-bəl,,being likely to cause objection : objectionable,adjective
circumstantiated,ˌsər-kəm-ˈstan(t)-shē-ˌāt,,to supply with circumstantial evidence or support,verb
ultraconservatives,ˌəl-trə-kən-ˈsər-və-tiv,,"extremely or extraordinarily conservative; especially : very strongly favoring, adhering to, or based upon the principles of conservatism (as in politics or religion)",adjective
hyperintellectual,ˌhī-pər-ˌin-tə-ˈlek-chə-wəl,,extremely or excessively intellectual,adjective
unserviceableness,ˌən-ˈsər-və-sə-bəl,,not ready or able to be used : not serviceable,adjective
stereomicroscopes,ˌster-ē-ō-ˈmī-krə-ˌskōp,,a microscope having a set of optics for each eye to make an object appear in three dimensions,noun
reconceptualizations,(ˌ)rē-kən-ˈsep-chə-wə-ˌlīz,,to conceptualize in a new or different way,verb
imperceptiveness,ˌim-pər-ˈsep-tiv,,not perceptive,adjective
exterritorialities,ˌek-ˌster-ə-ˈtȯr-ē-əl,,extraterritorial,adjective
anti-ideological,ˌan-tē-ˌī-dē-ə-ˈlä-ji-kəl,,opposed to or unconcerned with ideology : deliberately and emphatically not ideological,adjective
demilitarizations,(ˌ)dē-ˈmi-lə-tə-ˌrīz,,"to do away with the military organization or potential of; to prohibit (something, such as a zone or frontier area) from being used for military purposes; to rid of military characteristics or uses",verb
deinstitutionalization,(ˌ)dē-ˌin(t)-stə-ˌtü-shə-nə-lə-ˈzā-shən,,the release of institutionalized individuals from institutional care (as in a psychiatric hospital) to care in the community; the reform or modification of an institution to remove or disguise its institutional character,noun
neuropharmacologist,ˌnu̇r-ō-ˌfär-mə-ˈkä-lə-jē,,a branch of medical science dealing with the action of drugs on and in the nervous system; the properties and reactions of a drug on and in the nervous system,noun
pseudo-intellectual,,,a person who wants to be thought of as having a lot of intelligence and knowledge but who is not really intelligent or knowledgeable,noun
professionalisms,prə-ˈfesh-nə-ˌli-zəm,,"the conduct, aims, or qualities that characterize or mark a profession or a professional person; the following of a profession (such as athletics) for gain or livelihood",noun
antimaterialistic,ˌan-tē-mə-ˈtir-ē-ə-ˌli-zəm,,opposition to materialism,noun
overindustrializing,ˌō-vər-in-ˈdə-strē-ə-ˌlīz,,to industrialize (something) to an excessive degree,verb
departmentalization,di-ˌpärt-ˈmen-tə-ˌlīz,,to divide into departments,verb
supercorporations,ˌsü-pər-ˌkȯr-pə-ˈrā-shən,,an extremely large corporation,noun
overcapitalizing,ˌō-vər-ˈka-pə-tə-ˌlīz,,to put a nominal value on the capital of (a corporation) higher than actual cost or fair market value; to capitalize beyond what the business or the profit-making prospects warrant,verb
unconstitutionally,ˌən-ˌkän(t)-stə-ˈtü-sh(ə-)nəl,,not according or consistent with the constitution of a body politic (such as a nation),adjective
hypersusceptibility,ˌhī-pər-sə-ˈsep-tə-bəl,,extremely or excessively susceptible : hypersensitive,adjective
intercorrelation,ˌin-tər-ˌkȯr-ə-ˈlā-shən,,correlation between the members of a group of variables and especially between independent variables,noun
countermovements,ˈkau̇n-tər-ˌmüv-mənt,,a movement in an opposite direction; an organized movement that arises in opposition to something,noun
foresightednesses,ˈfȯr-ˌsīt,,an act or the power of foreseeing : prescience; provident care : prudence; an act of looking forward; also : a view forward,noun
homotransplantation,ˌhō-mō-ˈtran(t)s-ˌplant,,homograft,noun
contraindication,ˌkän-trə-ˌin-də-ˈkā-shən,,something (such as a symptom or condition) that makes a particular treatment or procedure inadvisable,noun
preincorporation,ˌprē-in-ˌkȯr-pə-ˈrā-shən,,existing or occurring before the formation of a corporation,adjective
companionableness,kəm-ˈpan-yə-nə-bəl,,"marked by, conducive to, or suggestive of companionship : sociable",adjective
counterattacking,ˈkau̇n-tər-ə-ˌtak,,an attack made in response to or in defense against an attack made by another,noun
counter-governments,ˌkau̇n-tər-ˈgə-vər(n)-mənt,,a group of people that organizes as an unofficial governing authority to oppose or supplant a legitimate or generally recognized government,noun
materialistically,mə-ˌtir-ē-ə-ˈli-stik,,"overly concerned or preoccupied with material possessions rather than with intellectual or spiritual things; of, relating to, or deriving from the theory or doctrine of materialism",adjective
misadministrations,ˌmis-əd-ˌmi-nə-ˈstrā-shən,,"the act, process, or an instance of administering poorly or wrongly : mistaken or improper administration",noun
supranationalities,ˌsü-prə-ˈnash-nəl,,"transcending national boundaries, authority, or interests",adjective
undependabilities,ˌən-di-ˈpen-də-bəl,,unable to be trusted or relied on : not dependable : unreliable,adjective
otolaryngological,ˌō-tō-ˌler-ən-ˈgä-lə-jē,,"a medical specialty concerned especially with the ear, nose, and throat and related parts of the head and neck —called also otorhinolaryngology",noun
unrepresentative,ˌən-ˌre-pri-ˈzen-tə-tiv,,not representative: such as; not typical or characteristic : atypical; not representing an electorate,adjective
anti-separatists,ˌan-tē-ˈse-p(ə-)rə-tist,,opposing or hostile toward separatism,adjective
distributivities,di-ˈstri-byü-tiv,,of or relating to distribution: such as; dealing a proper share to each of a group; diffusing more or less evenly,adjective
superimpositions,ˌsü-pər-im-ˈpōz,,to place or lay over or above something,verb
carboxymethylcellulose,kär-ˌbäk-sē-ˌme-thəl-ˈsel-yə-ˌlōs,,"an acid ether derivative of cellulose that in the form of its sodium salt is used as a thickening, emulsifying, and stabilizing agent and as a bulk laxative in medicine",noun
marginalizations,ˈmärj-nə-ˌlīz,,to relegate to an unimportant or powerless position within a society or group,verb
editorializations,ˌe-də-ˈtȯr-ē-ə-ˌlīz,,to express an opinion in the form of an editorial; to introduce opinion into the reporting of facts; to express an opinion (as on a controversial issue),verb
circumstantiating,ˌsər-kəm-ˈstan(t)-shē-ˌāt,,to supply with circumstantial evidence or support,verb
non-psychoactive,ˌnän-ˌsī-kō-ˈak-tiv,,not psychoactive : not producing an effect (such as changes in perception or behavior) on the mind or mental processes,adjective
counterattackers,ˈkau̇n-tər-ə-ˌtak,,an attack made in response to or in defense against an attack made by another,noun
crosslinguistically,ˈkrȯs-liŋ-ˈgwi-stik,,of or relating to languages of different families and types; especially : relating to the comparison of different languages,adjective
questionablenesses,ˈkwes-chə-nə-bəl,,"inviting inquiry; liable to judicial inquiry or action; affording reason for being doubted, questioned, or challenged : not certain or exact : problematic",adjective
noninterventions,ˌnän-ˌin-tər-ˈven(t)-shən,,the state or policy of not intervening,noun
largeheartedness,ˌlärj-ˈhär-təd,,having a generous disposition : sympathetic,adjective
substantialities,səb-ˈstan(t)-shəl,,"consisting of or relating to substance; not imaginary or illusory : real, true; important, essential",adjective
subconsciousness,ˌsəb-ˈkän(t)-shəs,,existing in the mind but not immediately available to consciousness,adjective
readministrations,(ˌ)rē-əd-ˈmi-nə-stər,,to administer (something) again,verb
establishmentarian,i-ˌsta-blish-mən-ˈter-ē-ən,,"of, relating to, or favoring the social or political establishment",adjective
impermissibility,ˌim-pər-ˈmi-sə-bəl,,not permissible,adjective
hypercoagulability,ˌhī-pər-kō-ˌa-gyə-lə-ˈbi-lə-tē,,a state or condition marked by an increased tendency to form blood clots within a blood vessel : excessive coagulability …,noun
anti-intellectualism,ˌan-tē-ˌin-tə-ˈlek-ch(ə-w)əl,,opposing or hostile to intellectuals or to an intellectual view or approach,adjective
discriminatingly,di-ˈskri-mə-ˌnā-tiŋ,,"making a distinction : distinguishing; marked by discrimination:; discerning, judicious",adjective
interchangeablenesses,ˌin-tər-ˈchān-jə-bəl,,capable of being interchanged; especially : permitting mutual substitution,adjective
syllabifications,sə-ˌla-bə-fə-ˈkā-shən,,syllabication,noun
chlorofluorocarbons,ˌklȯr-ō-ˌflȯr-ō-ˈkär-bən,,"any of several simple gaseous compounds that contain carbon, chlorine, fluorine, and sometimes hydrogen, that are used as refrigerants, cleaning solvents, and aerosol propellants and in the manufacture of plastic foams, and that are believed to be a major cause of stratospheric ozone depletion —abbreviation CFC",noun
methylprednisolone,ˌme-thəl-pred-ˈni-sə-ˌlōn,,a glucocorticoid C22H30O5 that is a derivative of prednisolone and is used as an anti-inflammatory agent; also : any of several of its salts (such as an acetate) used similarly,noun
nonconsciousness,ˌnän-ˈkän(t)-shəs,,not conscious : unconscious,adjective
constitutionally,ˌkän(t)-stə-ˈtü-shnə-lē,,"[""in accordance with one's constitution"", 'in structure, composition, or constitution; in accordance with a political constitution",adverb
psychopathically,ˌsī-kə-ˈpa-thik,,"of, relating to, or characterized by psychopathy",adjective
oversophisticated,ˌō-vər-sə-ˈfi-stə-ˌkā-təd,,excessively or needlessly sophisticated,adjective
unsustainability,ˌən-sə-ˈstā-nə-bəl,,not capable of being prolonged or continued : not sustainable,adjective
polyacrylonitrile,ˌpä-lē-ˌa-krə-lō-ˈnī-trəl,,a polymer of acrylonitrile used often as fibers,noun
sesquicentennial,ˌse-skwi-sen-ˈte-nē-əl,,a 150th anniversary or its celebration,noun
denitrifications,(ˌ)dē-ˌnī-trə-fə-ˈkā-shən,,the loss or removal of nitrogen or nitrogen compounds; specifically : reduction of nitrates or nitrites commonly by bacteria (as in soil) that usually results in the escape of nitrogen into the air,noun
chlorofluoromethanes,ˌklȯr-ō-ˌflȯr-ō-ˈme-ˌthān,,a chlorofluorocarbon derived from methane,noun
inter-departmentally,ˌin-tər-di-ˌpärt-ˈmen-tᵊl,,"existing, exchanged, or carried on between two or more departments (as of an organization) or their members; especially : characterized by participation or cooperation of two or more departments of an educational institution",adjective
intellectualnesses,ˌin-tə-ˈlek-chə-wəl,,of or relating to the intellect or its use; developed or chiefly guided by the intellect rather than by emotion or experience : rational; requiring use of the intellect,adjective
counter-instances,ˌkau̇n-tər-ˈin(t)-stən(t)s,,"a case that contradicts a rule, theory, etc. : exception",noun
pseudoephedrines,ˌsü-dō-i-ˈfed-rən,,an isomer of ephedrine used in the form of its hydrochloride or sulfate especially to relieve nasal congestion,noun
intercorrelating,ˌin-tər-ˈkȯr-ə-ˌlāt,,to exhibit correlation with each other —used of members of a group of variable and especially of independent variables; to correlate (members of a group of variables) with each other,verb
hyperintensities,ˌhī-pər-in-ˈten(t)s,,extremely or excessively intense; appearing as a bright or white spot or region in images of the brain (such as those produced by MRI),adjective
ultraconservatisms,ˌəl-trə-kən-ˈsər-və-tiv,,"extremely or extraordinarily conservative; especially : very strongly favoring, adhering to, or based upon the principles of conservatism (as in politics or religion)",adjective
undenominationally,ˌən-di-ˌnä-mə-ˈnā-sh(ə-)nəl,,not restricted or belonging to a religious denomination : not denominational,adjective
impracticabilities,(ˌ)im-ˈprak-ti-kə-bəl,,impassable; not practicable : incapable of being performed or accomplished by the means employed or at command,adjective
