word,phonetics,origin,definition,partOfSpeech
latitudinarianisms,ˌla-tə-ˌtü-də-ˈner-ē-ən,,not insisting on strict conformity to a particular doctrine or standard : tolerant; specifically : tolerant of variations in religious opinion or doctrine,adjective
recrystallization,(ˌ)rē-ˈkri-stə-ˌlīz,,to crystallize again or repeatedly,verb
sentimentalizing,ˌsen-tə-ˈmen-tə-ˌlīz,,to indulge in sentiment; to look upon or imbue with sentiment,verb
anti-colonialism,ˌan-tē-kə-ˈlō-nē-əl,,opposed to colonial rule of one country by another : opposing or resisting colonialism,adjective
anti-materialism,ˌan-tē-mə-ˈtir-ē-ə-ˌli-zəm,,opposition to materialism,noun
microdensitometric,ˈmī-krō-ˌden(t)-sə-ˈtä-mə-tər,,a densitometer for measuring the densities of microscopic areas,noun
hyperalimentation,ˌhī-pər-ˌa-lə-mən-ˈtā-shən,,the administration of nutrients by intravenous feeding especially to patients who cannot ingest food through the digestive tract,noun
cladogenetically,ˌkla-də-ˈje-nə-səs,,evolutionary change characterized by treelike branching of taxa,noun
indiscriminately,ˌin-di-ˈskri-mə-nət,,"not marked by careful distinction : deficient in discrimination and discernment; haphazard, random; promiscuous, unrestrained",adjective
indiscriminatingly,ˌin-di-ˈskri-mə-ˌnā-tiŋ,,not discriminating,adjective
hyper-concentrations,ˌhī-pər-ˌkän(t)-sən-ˈtrā-shən,,intense or excessive concentration,noun
pharmacodynamically,ˌfär-mə-kō-dī-ˈna-miks,,a branch of pharmacology dealing with the reactions between drugs and living systems,noun
misappropriations,ˌmi-sə-ˈprō-prē-ˌāt,,to appropriate wrongly (as by theft or embezzlement),verb
overindustrialisation,ˌō-vər-in-ˈdə-strē-ə-ˌlīz,,to industrialize (something) to an excessive degree,verb
intercommunications,ˌin-tər-kə-ˈmyü-nə-ˌkāt,,to exchange communication with one another; to afford passage from one to another,verb
noncompatibility,ˌnän-kəm-ˈpa-tə-bəl,,not compatible : incompatible,adjective
consubstantiation,ˌkän(t)-səb-ˌstan(t)-shē-ˈā-shən,,the actual substantial presence and combination of the body and blood of Christ with the eucharistic bread and wine according to a teaching associated with Martin Luther,noun
hyperparathyroidisms,ˌhī-pər-ˌper-ə-ˈthī-ˌrȯi-ˌdi-zəm,,"the presence of excess parathyroid hormone in the body resulting in disturbance of calcium metabolism with increase in serum calcium and decrease in inorganic phosphorus, loss of calcium from bone, and renal damage with frequent kidney-stone formation",noun
professionalized,prə-ˈfesh-nə-ˌlīz,,to give a professional character to,verb
pseudoscientific,ˌsü-dō-ˈsī-ən(t)s,,"a system of theories, assumptions, and methods erroneously regarded as scientific",noun
thermostabilities,ˌthər-mō-ˈstā-bəl,,stable when heated; specifically : retaining characteristic properties on being moderately heated,adjective
hyperaggressively,ˌhī-pər-ə-ˈgre-siv,,extremely or excessively aggressive,adjective
uncomprehendingly,ˌən-ˌkäm-pri-ˈhen-diŋ,,not comprehending : lacking understanding,adjective
microcalorimeter,ˌmī-krō-ˌka-lə-ˈri-mə-tər,,an instrument for measuring very small quantities of heat,noun
misapprehensions,(ˌ)mis-ˌa-pri-ˈhend,,to apprehend wrongly : misunderstand,verb
chlorofluoromethane,ˌklȯr-ō-ˌflȯr-ō-ˈme-ˌthān,,a chlorofluorocarbon derived from methane,noun
digressivenesses,dī-ˈgre-siv,,characterized by digressions,adjective
otolaryngologists,ˌō-tō-ˌler-ən-ˈgä-lə-jist,,a physician specializing in otolaryngology —called also otorhinolaryngologist,noun
intertranslatability,ˌin-tər-tran(t)s-ˈlā-tə-bəl,,able to be translated to and from one another,adjective
microcrystallinity,ˈmī-krō-ˌkri-stᵊl,,a microscopic crystal,noun
self-perpetuations,ˌself-pər-ˈpe-chə-ˌwā-tiŋ,,capable of continuing or renewing oneself indefinitely : capable of perpetuating oneself or itself,adjective
hydrofluorocarbon,ˌhī-drō-ˌflȯr-ō-ˈkär-bən,,"any of several simple gaseous compounds that contain carbon, fluorine, and hydrogen",noun
indescribablenesses,ˌin-di-ˈskrī-bə-bəl,,that cannot be described; surpassing description,adjective
editorialization,ˌe-də-ˈtȯr-ē-ə-ˌlīz,,to express an opinion in the form of an editorial; to introduce opinion into the reporting of facts; to express an opinion (as on a controversial issue),verb
reconfigurations,(ˌ)rē-kən-ˌfi-gyə-ˈrā-shən,,a new or different relative arrangement of parts or elements : the rearrangement of a previous configuration,noun
overcommunication,ˌō-vər-kə-ˈmyü-nə-ˌkāt,,to communicate excessively; to deliberately communicate more than is normal or generally considered necessary (as to emphasize important information),verb
electroretinographs,i-ˌlek-trō-ˈre-tə-nə-ˌgraf,,an instrument for recording electrical activity in the retina,noun
ecotoxicological,ˌē-kō-ˌtäk-si-ˈkä-lə-jē,,a scientific discipline combining the methods of ecology and toxicology in studying the effects of toxic substances and especially pollutants on the environment,noun
anthropomorphism,/ˌænθɹəpəˈmɔɹfɪzəm/,,The attribution of human characteristics and behavior to something not human.,noun
anthropomorphize,,,To endow with human qualities.,verb
anthropomorphous,,,Resembling a human being.,adjective
autobiographical,/ˌɑtoʊˌbaɪəˈɡɹæfəkəl/,,"Of or relating to a person's life or an account of a person's life, as told by the subject.",adjective
acquaintanceship,-ˌrād-ē-ə-ˈgraf-ik,,of or relating to autoradiographs or to autoradiography,adjective
anthropomorphise,-ˈrät-ik,,"of, relating to, or affected with arteriosclerosis",adjective
authoritarianism,,,"A form of government in which the governing body has absolute, or almost absolute, control. Typically this control is maintained by force, and little heed is paid to public opinion or the judicial system.",noun
anesthesiologist,,,to subject to anesthesia,verb
arteriosclerosis,/ˌɑɹˌtiɹioʊsklɚˈoʊsəs/,,"Hardening, narrowing or loss of elasticity in arteries or blood vessels.",noun
atrioventricular,,,Of the spatial relationship between the ventricles and the atria of the heart.,adjective
antagonistically,"ˈben-ˌzēl-(ˌ)pen-ə-ˈsil-ən, -zəl-",,penicillin g,noun
acanthopterygian,-ˌin-də-ˈkā-shən,,something (as a symptom or condition) that makes a particular treatment or procedure inadvisable,noun
affectionateness,-ˌther-ə-ˈpyüt-ik,,"of, relating to, or used in chemotherapy",adjective
advantageousness,ˌkris-tə-ˈläg-rə-fē,,a science that deals with the forms and structures of crystals,noun
appreciativeness,-ˈdis-trə-fē,,achondroplasia,noun
abdominocentesis,"ˌkem-i-ˌlü-mə-ˈnes-ᵊn(t)s, ˌkē-mi-",,luminescence (as bioluminescence) due to chemical reaction usually at low temperatures,noun
autoradiographic,-ˌrād-ē-ə-ˈgraf-ik,,of or relating to autoradiographs or to autoradiography,adjective
arteriosclerotic,-ˈrät-ik,,"of, relating to, or affected with arteriosclerosis",adjective
aminotransferase,ˌdər-mət-ō-sklə-ˈrō-səs,,scleroderma,noun
anthropocentrism,,,loss of minerals (as salts of calcium) from the body especially in disease; the process of removing mineral matter or salts (as from water),noun
anaesthetization,,,to subject to anesthesia,verb
anthropomorphist,ˌan(t)-thrə-pə-ˈmȯr-ˌfiz-əm,,an interpretation of what is not human or personal in terms of human or personal characteristics,noun
anthropomorphite,,,loss of minerals (as salts of calcium) from the body especially in disease; the process of removing mineral matter or salts (as from water),noun
benzylpenicillin,"ˈben-ˌzēl-(ˌ)pen-ə-ˈsil-ən, -zəl-",,penicillin g,noun
bronchopneumonia,,,"A bacterial infection of the lungs, characteristically showing numerous small foci of infection.",noun
circumnavigation,,,"The act of circumnavigating, or sailing round.",noun
characterization,,,The act or process of characterizing.,noun
chemotherapeutic,-ˌther-ə-ˈpyüt-ik,,"of, relating to, or used in chemotherapy",adjective
counteroffensive,,,"An attack made in response to a previous offensive, and intended to stop it.",noun
counterclockwise,,,Moving or located in the direction of rotation opposite from clockwise.,adjective
counterespionage,eth-ˈnäg-rə-fē,,the study and systematic recording of human cultures; also : a descriptive work produced from such research,noun
conventionalised,,,To make something conventional.,verb
conventionalized,,,To make something conventional.,verb
compartmentalize,/kɒmpɑː(ɹ)tˈmɛnt(ə)laɪz/,,To separate something into different categories or compartments.,verb
countersignature,,,A signature made to confirm or endorse another.,noun
characterisation,,,The act or process of characterizing.,noun
catastrophically,,,"In a catastrophic manner, or to a catastrophic extent; disastrously.",adverb
crystallographer,ˌkris-tə-ˈläg-rə-fē,,a science that deals with the forms and structures of crystals,noun
caryophyllaceous,,,"Of or pertaining to the pinks (of family Caryophyllaceae), especially describing plants that have their distinctive corollas",adjective
compartmentalise,ˌgran-yə-lō-ˌsīt-ə-ˈpē-nē-ə,,deficiency of blood granulocytes; especially : agranulocytosis,noun
commensurateness,-ˌd(y)ü-ə-(ˌ)dē-ˈnīt-əs,,inflammation of the stomach and duodenum,noun
chlordiazepoxide,,,A benzodiazepine derivative used as a sedative drug.,noun
chondrodystrophy,(ˈ)gīn-ˈan-drə-ˌmȯrf,,an abnormal individual exhibiting characters of both sexes in various parts of the body : a sexual mosaic,noun
cytoarchitecture,-ˌvent-ᵊl-ˈā-shən,,excessive ventilation; specifically : excessive rate and depth of respiration leading to abnormal loss of carbon dioxide from the blood —called also overventilation,noun
chemiluminescent,"ˌkem-i-ˌlü-mə-ˈnes-ᵊn(t)s, ˌkē-mi-",,luminescence (as bioluminescence) due to chemical reaction usually at low temperatures,noun
counterinsurgent,,,to remove the pituitary gland from,verb
counterintuitive,,,surgical removal of a hemorrhoid,noun
disfranchisement,-ˌvīt-ə-mə-ˈnō-səs,,an abnormal state resulting from excessive intake of one or more vitamins,noun
disproportionate,,,To undergo disproportionation,verb
decentralization,"-pə-ˈt(y)ü-ət-ə-ˌriz-əm, -ˈt(y)ü-ə-ˌtriz-",,excessive production of growth hormones by the pituitary gland,noun
decentralisation,-ˌsel-yə-ˈlar-ət-ē,,the presence of an abnormal excess of cells (as in bone marrow),noun
disconnectedness,,,to remove the pituitary gland from,verb
denominationally,ˌhī-pō-thə-ˈlam-ik,,of or relating to the hypothalamus,adjective
dermatosclerosis,ˌdər-mət-ō-sklə-ˈrō-səs,,scleroderma,noun
dedifferentiated,/diːˌdɪfəˈɹɛnʃɪeɪtəd/,,To lose or reverse differentiation,verb
diacetylmorphine,/daɪˌæs ɪ tl-ˈmɔɹ fin/,,The INN name for the drug heroin.,noun
demineralization,,,loss of minerals (as salts of calcium) from the body especially in disease; the process of removing mineral matter or salts (as from water),noun
demineralisation,,,loss of minerals (as salts of calcium) from the body especially in disease; the process of removing mineral matter or salts (as from water),noun
destructibleness,ˈī-(ˌ)sō-ə-ˌglüt-ᵊn-ˈā-shən,,agglutination of an agglutinogen of one individual by the serum of another of the same species,noun
deuterocanonical,,,"Being of the second canon of the Old Testament of the Bible, and not accepted by some Christians. Part of the Apocrypha.",adjective
discriminatively,ˌlim-ˌfan-jē-ek-ˈtā-zh(ē-)ə,,dilatation of the lymphatic vessels,noun
extraterritorial,ˌlim-ˌfan-jē-ek-ˈtā-zh(ē-)ə,,dilatation of the lymphatic vessels,noun
ecclesiastically,,,leukopoiesis,noun
enthusiastically,,,In an enthusiastic manner.,adverb
extraterrestrial,/ˌɛkstɹətɚˈɛstɹi.əl/,,"A being originating from outside of the Earth's atmosphere, from space, or from another planet; an alien",noun
environmentalism,,,"A theory that views environment, rather than heredity or culture, as the important factor in the development of an individual or group.",noun
environmentalist,,,"One who holds the view that environment, rather than heredity or culture, is the primary factor in the development of an individual or group.",noun
erythroblastosis,,,A medical condition in which erythroblasts are abnormally found in the blood,noun
electromyography,"ˌmī-ə-lō-mə-ˈniŋ-gə-ˌsēl, -mə-ˈnin-jə-",,spina bifida in which neural tissue of the spinal cord and the investing meninges protrude from the spinal column forming a sac under the skin,noun
echocardiography,ˌmȯr-fō-ˌfiz-ē-ə-ˈläj-i-kəl,,"of, relating to, or concerned with biological interrelationships between form and function",adjective
ethnographically,eth-ˈnäg-rə-fē,,the study and systematic recording of human cultures; also : a descriptive work produced from such research,noun
exterritoriality,-ˈfōt-ə-ˌgraf,,a small photograph that is normally magnified for viewing; photomicrograph,noun
elasmobranchiate,-kyu̇-ˈtā-nē-əs,,"of, relating to, supplying, or consisting of both muscle and skin",adjective
erythrogranulose,"-sə-ˈkī-ə-trē, -sī-",,a branch of medicine concerned with both neurology and psychiatry,noun
feeblemindedness,-ˌkal-si-ˈnō-səs,,a condition marked by calcification of the tubules of the kidney,noun
fundamentalistic,-ˌthē-lē-ˈō-mə,,a neurocytoma or glioma especially of the retina,noun
glossopharyngeal,ˌōt-ō-ˌlar-ən-ˈgäl-ə-jəst,,a physician specializing in otolaryngology —called also otorhinolaryngologist,noun
gynandromorphous,-ˈsī-klə-ˌmēn,,an anticholinergic drug with actions similar to atropine usually used in the form of its hydrochloride C20H28N2O3·HCl as an antispasmodic especially in the treatment of peptic ulcer,noun
glottochronology,/ˌɡlɒtəʊkɹəˈnɒlədʒi/,,The study of languages to determine when they diverged from being the same language.,noun
gastroenterology,,,"The study of the digestive system, from mouth to anus. May also include the study of accessory organs: pancreas, liver, gallbladder and bile ducts.",noun
gastroesophageal,,,Of or relating to the stomach and to the esophagus.,adjective
granulocytopenia,ˌgran-yə-lō-ˌsīt-ə-ˈpē-nē-ə,,deficiency of blood granulocytes; especially : agranulocytosis,noun
gastroduodenitis,-ˌd(y)ü-ə-(ˌ)dē-ˈnīt-əs,,inflammation of the stomach and duodenum,noun
gastroelytrotomy,-ˈmäl-ə-jē,,"a branch of medical science dealing with the structure, functions, and diseases of the eye",noun
gynandromorphism,(ˈ)gīn-ˈan-drə-ˌmȯrf,,an abnormal individual exhibiting characters of both sexes in various parts of the body : a sexual mosaic,noun
hyperventilation,-ˌvent-ᵊl-ˈā-shən,,excessive ventilation; specifically : excessive rate and depth of respiration leading to abnormal loss of carbon dioxide from the blood —called also overventilation,noun
hypersensitivity,,,Any heightened immune response to an antigen; an allergy; hypersensation,noun
hemimetamorphous,-(ˌ)sī-ˈkäl-ə-jəst,,a specialist in parapsychology,noun
hypophysectomize,,,to remove the pituitary gland from,verb
hemorrhoidectomy,,,surgical removal of a hemorrhoid,noun
hypervitaminosis,-ˌvīt-ə-mə-ˈnō-səs,,an abnormal state resulting from excessive intake of one or more vitamins,noun
heavyheartedness,-i-ˌlek-ˈtris-ət-ē,,electricity produced by the action of light; a branch of physics that deals with the electrical effects of light,noun
hyperpituitarism,"ˌfōt-ō-ˈsen(t)-sət-iv, -ˈsen(t)-stiv",,sensitive or sensitized to the action of radiant energy; being or caused by an abnormal reaction to sunlight,adjective
heterometabolous,-liŋ-ˈgwis-tik,,of or relating to psycholinguistics; of or relating to the psychological aspects of language,adjective
hemagglutination,,,"The agglutination of red blood cells, especially as a test for the presence of antibodies",noun
hemoglobinopathy,-ˌkō-nē-ˈō-səs,,pneumoconiosis,noun
haematocytopenia,ˌsī-kō-ˌpath-ə-ˈläj-i-kəl,,"of, relating to, or exhibiting psychopathology",adjective
hypercellularity,-ˌsel-yə-ˈlar-ət-ē,,the presence of an abnormal excess of cells (as in bone marrow),noun
hyperlipoidaemia,ˌflē-bō-thräm-ˈbō-səs,,venous thrombosis accompanied by little or no inflammation,noun
hypophysectomise,,,to remove the pituitary gland from,verb
hypopigmentation,,,Abnormally reduced pigmentation.,noun
hypothalamically,"ˌrent-gən-ˈäg-rə-fē, ˌrənt-, -jən-; ˌren-chən-, ˌrən-",,radiography,noun
hematocrystallin,-ˌsen(t)-sə-ˈtiv-ət-ē,,the quality or state of being radiosensitive,noun
hydrocarbostyril,ˌrī-nō-spə-ˌrid-ē-ˈō-səs,,"a fungal disease of the external mucous membranes (as of the nose) that is characterized by the formation of pinkish red, friable, sessile, or pedunculated polyps and is caused by an ascomycetous fungus of the genus Rhinosporidium (R. seeberi)",noun
hydroferricyanic,ˌsü-prə-ˌrē-nᵊl-ˈek-tə-mē,,adrenalectomy,noun
hydrofluosilicic,ˌspän-dil-är-ˈthrīt-əs,,arthritis of the spine,noun
intercommunicate,,,"To communicate mutually, one with another.",verb
intercontinental,/ˌɪn.tə.kɒn.tɪˈnɛn.təl/,,Taking place between two or more continents.,adjective
incomprehensible,/ˌɪnkɑmpɹəˈhɛnsɪbəl/,,Anything that is beyond understanding.,noun
irresponsibility,ˌtrī-ˌnī-trə-ˈglis-(ə-)rən,,nitroglycerin,noun
internationalise,,,To make something international; to involve multiple nations.,verb
institutionalise,,,To establish as a normal practice,verb
institutionalize,"tran(t)s-ˈpō(ə)rt, -ˈpȯ(ə)rt, ˈtran(t)s-ˌ",,to transfer or convey from one place to another,verb
inconclusiveness,ˌtrā-kē-ō-ˈbräŋ-kē-əl,,"of, relating to, affecting, or produced in the trachea and bronchi",adjective
indiscriminating,,,Indiscriminate,adjective
immunodeficiency,/ɪˌmjuːnəʊdɪˈfɪʃənsi/,,"A depletion in the body's natural immune system, or in some component of it.",noun
isoagglutination,ˈī-(ˌ)sō-ə-ˌglüt-ᵊn-ˈā-shən,,agglutination of an agglutinogen of one individual by the serum of another of the same species,noun
lymphangiectasis,ˌlim-ˌfan-jē-ek-ˈtā-zh(ē-)ə,,dilatation of the lymphatic vessels,noun
lymphangiectasia,ˌsīt-ō-ˈär-kə-ˌtek-chər,,the cellular makeup of a bodily tissue or structure,noun
lymphangiography,,,A radiographic procedure for imaging the lymphatic system.,noun
leucocytogenesis,"ˌkem-i-ˌlü-mə-ˈnes-ᵊn(t)s, ˌkē-mi-",,luminescence (as bioluminescence) due to chemical reaction usually at low temperatures,noun
labyrinthibranch,"ˌklōr-ˌte-trə-ˈsī-ˌklēn, ˌklȯr-",,a yellow crystalline broad-spectrum antibiotic C22H23ClN2O8 produced by a soil actinomycete of the genus Streptomyces (S. aureofaciens) and sometimes used in animal feeds to stimulate growth,noun
lactobutyrometer,"ˌkärd-ē-ō-ˈres-p(ə-)rə-ˌtōr-ē, -ri-ˈspī-rə-, -ˌtȯr-",,of or relating to the heart and the respiratory system : cardiopulmonary,adjective
lithophotography,ˌsīt-ō-ˌär-kə-(ˌ)tek-ˈtän-iks,,cytoarchitecture,noun
multifariousness,-hī-ˈdant-ə-wən,,phenytoin,noun
mispronunciation,/mɪspɹəˌnaʊn.siˈeɪ.ʃən/,,The act of mispronouncing.,noun
monocotyledonous,,,the process or result of getting out of synchronization,noun
multidimensional,,,(New Age religion) a being that exists in more than one dimension,noun
multiculturalism,,,"The characteristics of a society, city etc. which has many different ethnic or national cultures mingling freely; political or social policies which support or encourage such coexistence.",noun
microgametophyte,-ˈkärd-ē-ə-ˌgram,,the tracing made by an electrocardiograph; also : the procedure for producing an electrocardiogram,noun
myelomeningocele,i-ˌlek-trō-ˈneg-ət-iv,,charged with negative electricity; having a tendency to attract electrons,adjective
monosyllabically,in-ˌsef-ə-lō-ˌmī-ə-ˈlīt-əs,,concurrent inflammation of the brain and spinal cord,noun
michelangelesque,-ˈret-ᵊn-ə-ˌgram,,a graphic record of electrical activity of the retina used especially in the diagnosis of retinal conditions,noun
multiprogramming,,,"The allocation of computing resources to more than one concurrent application, job, or user.",noun
marginocephalian,i-ˌlek-trə-ˈstat-ik,,of or relating to static electricity or electrostatics,adjective
morphophysiology,ˌek-ō-in-ˈsef-ə-lə-ˌgram,,a visual record obtained by echoencephalography,noun
mesembryanthemum,,,Any of the genus Mesembryanthemum of herbaceous or suffruticose plants.,noun
microphotography,-ˈräs-tə-mē,,the surgical formation of a passage between the stomach and small intestine,noun
musculocutaneous,,,surgical removal of a hemorrhoid,noun
microcosmography,,,to remove the pituitary gland from,verb
maleconformation,ˌhī-pə-ˌral-ə-mən-ˈtā-shən,,the administration of nutrients by intravenous feeding especially to patients who cannot ingest food through the digestive tract,noun
neurotransmitter,"ˌhet-ə-rə-ˈjē-nē-əs, ˌhe-trə-, -nyəs",,not uniform in structure or composition,adjective
nonreciprocating,,,agglutination of red blood cells,noun
noncontroversial,,,Not controversial; not likely to cause controversy,adjective
neuropsychiatric,,,"[""a blood disorder (as sickle cell anemia or Cooley's anemia) that is caused by a genetically determined change in the molecular structure of hemoglobin""]",noun
noncomprehensive,,,to remove the pituitary gland from,verb
nonparticipation,,,Abstinence from social activities.,noun
nontranslational,-sə-ˈpres-ᵊnt,,an agent (such as a drug) that suppresses the immune response,noun
nontransmissible,-sə-ˈpresh-ən,,suppression (as by drugs or disease) of the immune response,noun
nonvolatilisable,ˌim-yə-nō-sə-ˈpres-iv,,causing or characterized by immunosuppression,adjective
nephrocalcinosis,-ˌkal-si-ˈnō-səs,,a condition marked by calcification of the tubules of the kidney,noun
neuroepithelioma,-ˈkäm-prə-ˌmīzd,,having the immune system impaired or weakened (as by drugs or illness),adjective
neurolinguistics,-ˈther-ə-pē,,"treatment or prevention of disease (such as a cancer, autoimmune disorder, or allergy) that involves the stimulation, enhancement, suppression, or desensitization of the immune system —called also immune therapy",noun
neurosensiferous,"lə-ˌriŋ-gō-ˌfar-ən-ˈjē-əl, -fə-ˈrin-j(ē-)əl",,of or common to both the larynx and the pharynx,adjective
overcompensation,,,inflammation of the white matter of the brain,noun
overexploitation,,,Excessive and damaging exploitation,noun
oxyphencyclimine,-ˈsī-klə-ˌmēn,,an anticholinergic drug with actions similar to atropine usually used in the form of its hydrochloride C20H28N2O3·HCl as an antispasmodic especially in the treatment of peptic ulcer,noun
obdiplostemonous,ˌmal-əd-ˌmin-ə-ˈstrā-shən,,incorrect administration (as of a drug),noun
oppositipetalous,-ˈspek-trə-ˌskōp,,a spectroscope arranged for attachment to a microscope for observation of the spectrum of light from minute portions of an object,noun
ophthalmological,-ˈmäl-ə-jē,,"a branch of medical science dealing with the structure, functions, and diseases of the eye",noun
ornithoidichnite,-fī-ˌbrō-mə-ˈtō-səs,,"[""an inherited developmental disorder characterized especially by brown spots on the skin that are typically present at birth, neurofibromas of peripheral nerves, and deformities of subcutaneous tissues and bone —abbreviation NF, NF-1—called also Recklinghausen's disease, von Recklinghausen's disease"", 'an inherited disorder characterized by bilateral acoustic neuromas developing in childhood or early adulthood that are typically accompanied by other nonmalignant tumors of the central nervous system —abbreviation NF, NF-2",noun
prestidigitation,"ˌnī-trō-ˌhī-drə-ˌklōr-ik-, -ˌklȯr-",,aqua regia,noun
phantasmagorical,"ˌäm(p)-fə-lō-ˌmez-ᵊn-ˈter-ik, -ˌmes-",,of or relating to the navel and mesentery,adjective
psychophysiology,,,The branch of physiology that deals with the interaction of the mind and physiological processes,noun
parapsychologist,-ˌther-ə-ˈpyüt-ik,,"of, relating to, or used in psychotherapy",adjective
photolithography,"-ˌkän-ˌdək-ˈtiv-ət-ē, -kən-",,electrical conductivity that is affected by exposure to electromagnetic radiation (as light),noun
piezoelectricity,,,The ability of certain crystals to generate a voltage in response to applied mechanical stress.,noun
photocoagulation,,,"A surgical procedure in which a tumour, or diseased retinal tissue, is destroyed by using a laser.",noun
perchloromethane,ˌsī-kō-liŋ-ˈgwis-tiks,,"the study of the mental faculties involved in the perception, production, and acquisition of language",noun
photoelectricity,-i-ˌlek-ˈtris-ət-ē,,electricity produced by the action of light; a branch of physics that deals with the electrical effects of light,noun
photosensitivity,ˌfär-mə-ˈkäl-ə-jē,,"the science of drugs including their origin, composition, pharmacokinetics, therapeutic use, and toxicology; the properties and reactions of drugs especially with relation to their therapeutic value",noun
palaeodendrology,"ˌpent-i-ˌlēn-ˈte-trə-ˌzȯl, -ˌzōl",,"a white crystalline drug C6H10N4 formerly used as a respiratory, circulatory, and central nervous system stimulant",noun
phylogenetically,ˌfiz-ē-ō-ˌther-ə-ˈpyüt-ik,,of or relating to physical therapy,adjective
pharmacogenetics,,,The study of genetic variation that gives rise to differing responses to drugs.,noun
pharmacokinetics,,,"A branch of pharmacology concerned with the rate at which drugs are absorbed, distributed, metabolized, and eliminated by the body.",noun
paleoclimatology,,,The scientific study of prehistoric climate of the Earth.,noun
